<?xml version="1.0" encoding="UTF-8" standalone="no"?>
<xs:schema  xmlns:xs="http://www.w3.org/2001/XMLSchema">
  <xs:element name="listatickets">
    <xs:complexType>
      <xs:sequence>
        <xs:element name="ticket" maxOccurs="unbounded" minOccurs="0">
          <xs:complexType>
            <xs:sequence>
              <xs:element type="xs:short" name="numero"/>
              <xs:element type="xs:date" name="fecha"/>
              <xs:element type="xs:time" name="hora"/>
              <xs:element name="producto" maxOccurs="unbounded" minOccurs="0">
                <xs:complexType>
                  <xs:sequence>
                    <xs:element type="xs:string" name="nombre"/>
                    <xs:element type="xs:float" name="precio"/>
                  </xs:sequence>
                </xs:complexType>
              </xs:element>
              <xs:element type="xs:float" name="total"/>
            </xs:sequence>
          </xs:complexType>
        </xs:element>
      </xs:sequence>
    </xs:complexType>
  </xs:element>
</xs:schema>